{
  "$schema": "local://records/record-v3.0.0.json",
  "id": "abcde-12345",
  "pid": {
    "pk": 1,
    "status": "R"
  },
  "pids": {
    "doi": {
      "identifier": "10.5281/zenodo.1234",
      "provider": "datacite",
      "client": "zenodo"
    },
    "concept-doi": {
      "identifier": "10.5281/zenodo.1234",
      "provider": "datacite",
      "client": "zenodo"
    },
    "handle": {
      "identifier": "9.12314",
      "provider": "cern-handle",
      "client": "zenodo"
    },
    "oai": {
      "identifier": "oai:zenodo.org:12345",
      "provider": "zenodo"
    }
  },
  "tombstone": {
    "reason": "Spam record, removed by InvenioRDM staff.",
    "category": "spam_manual",
    "removed_by": {"user": 1},
    "timestamp": "2020-09-01T12:02:00+0000"
  }
}
